<?xml version="1.0" encoding="UTF-8"?>
<!DOCTYPE empresa [
    <!ELEMENT empresa (empleado+)>
    <!ELEMENT empleado (apellido+, nombre+, numEmpleado?, email?, telefono*, direccion+)>
    <!ELEMENT apellido (#PCDATA)>
    <!ELEMENT nombre (#PCDATA)>
    <!ELEMENT numEmpleado (#PCDATA)>
    <!ELEMENT email (#PCDATA)>
    <!ELEMENT telefono (#PCDATA)>
    <!ELEMENT direccion (calle, ciudad, cp )>
        <!ELEMENT calle (#PCDATA)>
        <!ELEMENT ciudad (#PCDATA)>
        <!ELEMENT cp (#PCDATA)>
]>
<empresa>
  <empleado>
    <apellido>Perez</apellido>
    <nombre>Juan</nombre>
    <numEmpleado>1234567890</numEmpleado>
    <email>juanperez@gmail.com</email>
    <telefono>666 555 444</telefono>
    <direccion>
      <calle>Carrer de Pau Claris, 121</calle>
      <ciudad>Barcelona</ciudad>
      <cp>08009</cp>
    </direccion>  
  </empleado>
</empresa>